<?xml version="1.0" encoding="UTF-8"?>
<xs:schema xmlns:xs="http://www.w3.org/2001/XMLSchema">
	<xs:element name="list">
		<xs:complexType>
			<xs:sequence minOccurs="1" maxOccurs="1">
				<xs:element name="experience" minOccurs="1" maxOccurs="100">
					<xs:complexType>
						<xs:attribute name="level" use="required" type="xs:byte" />
						<xs:attribute name="val" use="required" type="xs:float" />
					</xs:complexType>
				</xs:element>
			</xs:sequence>
		</xs:complexType>
	</xs:element>
</xs:schema>